{
  "schema_version": "1.0.0",
  "run_id": "mrun:01JBQG00000000000000000000",
  "kind": "manual",
  "state": "completed",
  "environment": {
    "declared": {
      "name": "Tester laptop against staging",
      "url": "https://staging.acme.example",
      "version": "unknown"
    }
  },
  "baseline": {
    "packages": [
      {
        "package_id": "pkg:acme-portal",
        "package_version": 3
      }
    ],
    "revision": {
      "kind": "git_commit",
      "value": "4b775e0c2a9d1f3e5b7c9d0e1f2a3b4c5d6e7f80",
      "worktree_dirty": false
    }
  },
  "started_at": "2026-10-21T10:05:00Z",
  "finished_at": "2026-10-21T10:12:00Z",
  "cases": [
    {
      "scenario_id": "scenario:registration.nib.invalid_length_12",
      "version": 1,
      "approval_id": "approval:01JBQF00000000000000000000",
      "outcome": "failed",
      "reported_by": "tester",
      "defect_ids": ["defect:01JBQH00000000000000000000"],
      "steps": [
        {
          "step_id": "S1",
          "status": "pass"
        },
        {
          "step_id": "S2",
          "status": "pass"
        },
        {
          "step_id": "S3",
          "status": "fail",
          "expected": "A NIB format error is shown.",
          "actual": "Registration was accepted.",
          "evidence_refs": ["blob:screenshot-1"],
          "notes": "Field accepted 12 digits."
        }
      ]
    }
  ]
}
